{
  "$schema": "https://ankurs47.github.io/skate-program-editor/docs/program.skate.schema.json",
  "format": "skate-program",
  "version": 1,
  "name": "my 2027 junior long",
  "event": {
    "level": "usfs-jr",
    "label": "Junior — 3:30 ±10s",
    "targetSeconds": 210,
    "toleranceSeconds": 10
  },
  "songs": [
    {
      "name": "opening theme.m4a",
      "title": "Opening Theme — Live at the Proms",
      "bytes": 3411920,
      "seconds": 96.4,
      "fingerprint": "a3f1c08e5b2d4790",
      "source": {
        "kind": "youtube",
        "url": "https://www.youtube.com/watch?v=dQw4w9WgXcQ",
        "title": "Opening Theme — Live at the Proms",
        "channel": "Some Orchestra",
        "addedAt": "2026-08-25",
        "format": "140 m4a 128k"
      }
    },
    {
      "name": "the slow part.opus",
      "title": "Adagio in G minor",
      "bytes": 1802440,
      "seconds": 84.0,
      "fingerprint": "7c9e21b40af6d385",
      "source": {
        "kind": "youtube",
        "url": "https://www.youtube.com/watch?v=aqz-KE-bpKQ",
        "title": "Adagio in G minor",
        "channel": "Another Channel",
        "addedAt": "2026-08-25",
        "format": "251 opus 160k"
      }
    },
    {
      "name": "big finish.m4a",
      "title": "Big Finish",
      "bytes": 2966112,
      "seconds": 74.0,
      "fingerprint": "1d5a8f30c7e29b64",
      "source": {
        "kind": "purchase",
        "title": "Big Finish",
        "note": "bought from the artist's site — better master than the video"
      }
    }
  ],
  "clips": [
    {
      "id": "opening",
      "song": "opening theme.m4a",
      "start": 6.0,
      "end": 80.0,
      "fadeIn": 1.2,
      "fadeOut": 0,
      "blend": 0,
      "gainDb": 0
    },
    {
      "id": "slow",
      "song": "the slow part.opus",
      "title": "the slow part",
      "start": 12.0,
      "end": 82.0,
      "fadeIn": 0,
      "fadeOut": 0,
      "blend": 1.8,
      "gainDb": -1.7
    },
    {
      "id": "finish",
      "song": "big finish.m4a",
      "start": 4.0,
      "end": 72.0,
      "fadeIn": 0,
      "fadeOut": 2.6,
      "blend": 1.4,
      "gainDb": 0
    }
  ],
  "export": {
    "format": "mp3",
    "bitrate": 320
  },
  "writtenBy": {
    "app": "skate-desktop",
    "version": "0.1.0"
  },
  "updatedAt": "2026-08-25",
  "mediaDir": "media",
  "notes": "coach wants the slow part a little longer next time"
}
